1,1,"What fabric is the top made of?","2018-01-04","yankeelover","first.last@gmail.com",0,1
2,1,"HEY THIS IS A WEIRD QUESTION!!!!?","2019-04-28","jbilas","first.last@gmail.com",1,4
3,1,"Does this product run big or small?","2019-01-17","jbilas","first.last@gmail.com",0,8
4,1,"How long does it last?","2019-07-06","funnygirl","first.last@gmail.com",0,6
5,1,"Can I wash it?","2018-02-08","cleopatra","first.last@gmail.com",0,7
11896,3432,"Quia recusandae occaecati quia id perferendis quasi harum illo velit.","2018-10-13","Jude49","Lora_Cassin85@gmail.com",0,25
11897,3432,"Ipsam veritatis tempore minima suscipit voluptates omnis id consequuntur.","2018-08-20","Garfield.Kub","Faustino29@gmail.com",0,5
